{
  "$schema": "../../schema/locale.schema.json",
  "locale": "es",
  "category": "logic",
  "version": "1.0.0",
  "translations": {
    "modules.logic.and.description": "Realizar operación lógica AND",
    "modules.logic.and.label": "Lógica AND",
    "modules.logic.and.output.result.description": "Valores booleanos para combinar con AND",
    "modules.logic.and.output.total_count.description": "Resultado de la operación AND",
    "modules.logic.and.output.true_count.description": "Resultado de la operación AND",
    "modules.logic.and.params.values.description": "Valores booleanos para combinar con AND",
    "modules.logic.and.params.values.label": "Valores",
    "modules.logic.contains.description": "Verificar si un valor contiene otro valor",
    "modules.logic.contains.label": "Lógica Contiene",
    "modules.logic.contains.output.count.description": "Si el pajar contiene la aguja",
    "modules.logic.contains.output.position.description": "Si el pajar contiene la aguja",
    "modules.logic.contains.output.result.description": "Búsqueda sensible a mayúsculas y minúsculas para cadenas",
    "modules.logic.contains.params.case_sensitive.description": "Valor a buscar",
    "modules.logic.contains.params.case_sensitive.label": "Aguja",
    "modules.logic.contains.params.haystack.description": "Valor donde buscar (cadena, array u objeto)",
    "modules.logic.contains.params.haystack.label": "Pajar",
    "modules.logic.contains.params.needle.description": "Valor donde buscar (cadena, array u objeto)",
    "modules.logic.contains.params.needle.label": "Pajar",
    "modules.logic.equals.description": "Verificar si dos valores son iguales",
    "modules.logic.equals.label": "Lógica Igual",
    "modules.logic.equals.output.result.description": "Comparación de cadenas sensible a mayúsculas y minúsculas",
    "modules.logic.equals.output.type_a.description": "Si los valores son iguales",
    "modules.logic.equals.output.type_b.description": "Si los valores son iguales",
    "modules.logic.equals.params.a.description": "Primer valor a comparar",
    "modules.logic.equals.params.a.label": "Valor A",
    "modules.logic.equals.params.b.description": "Primer valor a comparar",
    "modules.logic.equals.params.b.label": "Valor A",
    "modules.logic.equals.params.case_sensitive.description": "Requiere el mismo tipo (sin coerción de tipo)",
    "modules.logic.equals.params.case_sensitive.label": "Estricto",
    "modules.logic.equals.params.strict.description": "Segundo valor a comparar",
    "modules.logic.equals.params.strict.label": "Valor B",
    "modules.logic.not.description": "Realizar operación lógica NOT",
    "modules.logic.not.label": "Lógica NOT",
    "modules.logic.not.output.original.description": "Resultado negado",
    "modules.logic.not.output.result.description": "Valor booleano a negar",
    "modules.logic.not.params.value.description": "Valor booleano a negar",
    "modules.logic.not.params.value.label": "Valor",
    "modules.logic.or.description": "Realizar operación lógica OR",
    "modules.logic.or.label": "Lógica OR",
    "modules.logic.or.output.result.description": "Valores booleanos para combinar con OR",
    "modules.logic.or.output.total_count.description": "Resultado de la operación OR",
    "modules.logic.or.output.true_count.description": "Resultado de la operación OR",
    "modules.logic.or.params.values.description": "Valores booleanos para combinar con OR",
    "modules.logic.or.params.values.label": "Valores"
  }
}
