{
  "$schema": "../../schema/locale.schema.json",
  "locale": "es",
  "category": "cloud.ai",
  "version": "1.0.0",
  "translations": {
    "cloud.aiAgent.advancedOptions": "Opciones avanzadas",
    "cloud.aiAgent.availableTools": "Herramientas disponibles",
    "cloud.aiAgent.enableEvolution": "Habilitar evolución de herramientas",
    "cloud.aiAgent.enableEvolutionHint": "Permitir que el agente solicite nuevas herramientas cuando sea necesario",
    "cloud.aiAgent.error": "Error",
    "cloud.aiAgent.evolvedTools": "Herramientas evolucionadas: {tools}",
    "cloud.aiAgent.fromInput": "Desde entrada",
    "cloud.aiAgent.goal": "Objetivo / Descripción de tarea",
    "cloud.aiAgent.goalPlaceholder": "Describa lo que el agente debe lograr...",
    "cloud.aiAgent.input": "Entrada",
    "cloud.aiAgent.iteration": "Iteración {current} / {max}",
    "cloud.aiAgent.joinStrategy": "Estrategia de unión de arreglos",
    "cloud.aiAgent.llmCalls": "Llamadas LLM: {count}",
    "cloud.aiAgent.manual": "Manual",
    "cloud.aiAgent.maxIterations": "Iteraciones máximas",
    "cloud.aiAgent.maxIterationsHint": "Ciclos máximos de Observar-Pensar-Actuar-Verificar",
    "cloud.aiAgent.memory": "Memoria",
    "cloud.aiAgent.model": "Modelo",
    "cloud.aiAgent.output": "Resultado",
    "cloud.aiAgent.promptPath": "Ruta de entrada",
    "cloud.aiAgent.promptPathHint": "Expresión para obtener el prompt del nodo anterior",
    "cloud.aiAgent.promptSource": "Origen del prompt",
    "cloud.aiAgent.selectVariable": "Seleccionar variable",
    "cloud.aiAgent.status.acting": "Actuando",
    "cloud.aiAgent.status.checking": "Verificando",
    "cloud.aiAgent.status.completed": "Completado",
    "cloud.aiAgent.status.evolving": "Evolucionando herramienta",
    "cloud.aiAgent.status.failed": "Fallido",
    "cloud.aiAgent.status.initializing": "Inicializando...",
    "cloud.aiAgent.status.observing": "Observando",
    "cloud.aiAgent.status.paused": "Pausado",
    "cloud.aiAgent.status.thinking": "Pensando",
    "cloud.aiAgent.status.waiting_input": "Esperando entrada",
    "cloud.aiAgent.status.waiting_tool": "Esperando herramienta",
    "cloud.aiAgent.task": "Tarea",
    "cloud.aiAgent.taskPlaceholder": "Describa lo que el agente debe lograr...",
    "cloud.aiAgent.title": "Agente de IA",
    "cloud.aiAgent.tools": "Herramientas",
    "cloud.aiAgent.toolsHint": "Seleccione qué módulos puede usar el agente",
    "cloud.chat.attachFile": "Adjuntar archivo",
    "cloud.chat.error": "Error al enviar mensaje",
    "cloud.chat.fileTooLarge": "El archivo es muy grande (máx. 10MB)",
    "cloud.chat.loadFailed": "Error al cargar mensajes",
    "cloud.chat.loading": "Cargando...",
    "cloud.chat.loadingMessages": "Cargando mensajes...",
    "cloud.chat.messageUser": "Mensaje",
    "cloud.chat.messages": "Mensajes",
    "cloud.chat.noConversations": "Aún no hay conversaciones",
    "cloud.chat.noConversationsDesc": "Comience a chatear con otros usuarios desde su página de perfil",
    "cloud.chat.noMessages": "Aún no hay mensajes. ¡Saluda!",
    "cloud.chat.online": "En línea",
    "cloud.chat.searchConversations": "Buscar conversaciones...",
    "cloud.chat.selectConversation": "Seleccione una conversación para comenzar a chatear",
    "cloud.chat.selectConversationHint": "Seleccione una conversación para comenzar a chatear",
    "cloud.chat.send": "Enviar",
    "cloud.chat.sendMessage": "Enviar",
    "cloud.chat.sending": "Enviando...",
    "cloud.chat.startChat": "Iniciar chat",
    "cloud.chat.startChatFailed": "Error al iniciar el chat",
    "cloud.chat.startConversation": "Iniciar una conversación",
    "cloud.chat.subtitle": "Chatear con otros usuarios",
    "cloud.chat.today": "Hoy",
    "cloud.chat.typePlaceholder": "Escriba un mensaje...",
    "cloud.chat.uploadFailed": "Error al cargar el archivo",
    "cloud.chat.user": "Usuario",
    "cloud.chat.viewProfile": "Ver perfil",
    "cloud.chat.yesterday": "Ayer",
    "cloud.huggingface.browseMoreModels": "Explorar más modelos",
    "cloud.huggingface.chooseModel": "Elegir modelo",
    "cloud.huggingface.inferenceAPI": "API de inferencia",
    "cloud.huggingface.installedModels": "Modelos instalados",
    "cloud.huggingface.localExecution": "Ejecución local",
    "cloud.huggingface.noModelsAvailable": "No hay modelos disponibles",
    "cloud.huggingface.notInstalled": "No instalado",
    "cloud.huggingface.popularModels": "Modelos populares",
    "cloud.huggingface.selectModel": "Seleccionar modelo",
    "cloud.llmChain.advancedOptions": "Opciones avanzadas",
    "cloud.llmChain.detectedVariables": "Variables detectadas",
    "cloud.llmChain.insertVariable": "Insertar variable",
    "cloud.llmChain.maxTokens": "Tokens máximos",
    "cloud.llmChain.maxTokensHint": "Longitud máxima de la respuesta",
    "cloud.llmChain.model": "Modelo",
    "cloud.llmChain.output": "Respuesta",
    "cloud.llmChain.provider": "Proveedor",
    "cloud.llmChain.providers.claude": "Claude",
    "cloud.llmChain.providers.ollama": "Ollama (Local)",
    "cloud.llmChain.providers.openai": "OpenAI",
    "cloud.llmChain.systemPrompt": "Prompt del sistema",
    "cloud.llmChain.systemPromptPlaceholder": "Eres un asistente útil...",
    "cloud.llmChain.temperature": "Temperatura",
    "cloud.llmChain.temperatureHint": "Mayor = más creativo, Menor = más enfocado",
    "cloud.llmChain.testPrompt": "Probar prompt",
    "cloud.llmChain.title": "Cadena LLM",
    "cloud.llmChain.userPrompt": "Prompt del usuario",
    "cloud.llmChain.userPromptPlaceholder": "Ingrese su prompt con {{variables}}...",
    "cloud.llmChain.variableHelp": "Use {{variable}} para referenciar datos de pasos anteriores",
    "cloud.vectorStore.addMetadata": "Agregar campo",
    "cloud.vectorStore.collection": "Colección",
    "cloud.vectorStore.collectionName": "Nombre de colección",
    "cloud.vectorStore.content": "Contenido del documento",
    "cloud.vectorStore.contentPlaceholder": "Ingrese texto o use {{variable}}...",
    "cloud.vectorStore.createCollection": "Crear nueva colección",
    "cloud.vectorStore.deleteFilter": "Eliminar por filtro",
    "cloud.vectorStore.deleteIds": "IDs de documentos a eliminar",
    "cloud.vectorStore.deleteSuccess": "Se eliminaron {count} documentos",
    "cloud.vectorStore.documentId": "ID de documento (opcional)",
    "cloud.vectorStore.filters": "Filtros de metadatos",
    "cloud.vectorStore.insertSuccess": "Documento insertado",
    "cloud.vectorStore.metadata": "Metadatos",
    "cloud.vectorStore.noCollections": "No se encontraron colecciones",
    "cloud.vectorStore.noMetadata": "Sin campos de metadatos",
    "cloud.vectorStore.operation": "Operación",
    "cloud.vectorStore.operations.delete": "Eliminar",
    "cloud.vectorStore.operations.insert": "Insertar",
    "cloud.vectorStore.operations.search": "Buscar",
    "cloud.vectorStore.output": "Resultados",
    "cloud.vectorStore.query": "Consulta",
    "cloud.vectorStore.queryPlaceholder": "Ingrese consulta de búsqueda o use {{variable}}...",
    "cloud.vectorStore.refreshCollections": "Actualizar colecciones",
    "cloud.vectorStore.scoreThreshold": "Umbral de puntuación",
    "cloud.vectorStore.scoreThresholdHint": "Puntuación mínima de similitud (0-1)",
    "cloud.vectorStore.searchResults": "Se encontraron {count} resultados",
    "cloud.vectorStore.selectCollection": "Seleccionar colección...",
    "cloud.vectorStore.title": "Almacén de vectores",
    "cloud.vectorStore.topK": "Top K resultados"
  }
}
