{
  "$schema": "../../schema/locale.schema.json",
  "locale": "it",
  "category": "element",
  "version": "1.0.0",
  "translations": {
    "modules.element.attribute.description": "Ottieni elemento",
    "modules.element.attribute.label": "Ottieni Attributo",
    "modules.element.attribute.output.status.description": "Nome attributo (es. href, src, class)",
    "modules.element.attribute.output.value.description": "Stato operazione (successo/errore)",
    "modules.element.attribute.params.element_id.description": "ID Elemento (UUID)",
    "modules.element.attribute.params.element_id.label": "ID Elemento",
    "modules.element.attribute.params.name.description": "ID Elemento (UUID)",
    "modules.element.attribute.params.name.label": "ID Elemento",
    "modules.element.query.description": "Trova elementi figlio all'interno dell'elemento",
    "modules.element.query.label": "Interroga Elemento",
    "modules.element.query.output.count.description": "ID elemento trovato (modalita singola)",
    "modules.element.query.output.element_id.description": "Stato operazione (successo/errore)",
    "modules.element.query.output.element_ids.description": "Stato operazione (successo/errore)",
    "modules.element.query.output.status.description": "Se trovare tutti gli elementi corrispondenti (default: false, trova solo il primo)",
    "modules.element.query.params.all.description": "Selettore CSS per trovare elementi figlio",
    "modules.element.query.params.all.label": "Selettore CSS",
    "modules.element.query.params.element_id.description": "ID elemento padre (UUID)",
    "modules.element.query.params.element_id.label": "ID Elemento",
    "modules.element.query.params.selector.description": "ID elemento padre (UUID)",
    "modules.element.query.params.selector.label": "ID Elemento",
    "modules.element.text.description": "Ottieni elemento",
    "modules.element.text.label": "Ottieni Testo",
    "modules.element.text.output.status.description": "ID Elemento (UUID)",
    "modules.element.text.output.text.description": "ID Elemento (UUID)",
    "modules.element.text.params.element_id.description": "ID Elemento (UUID)",
    "modules.element.text.params.element_id.label": "ID Elemento"
  }
}
