{
  "$schema": "../../schema/locale.schema.json",
  "locale": "zh-CN",
  "category": "meta",
  "version": "1.0.0",
  "translations": {
    "modules.meta.modules.generate.description": "",
    "modules.meta.modules.generate.label": "",
    "modules.meta.modules.list.description": "",
    "modules.meta.modules.list.label": "",
    "modules.meta.modules.list.output.count.description": "",
    "modules.meta.modules.list.output.formatted.description": "",
    "modules.meta.modules.list.output.modules.description": "",
    "modules.meta.modules.list.output.modules.properties.category.description": "",
    "modules.meta.modules.list.output.modules.properties.description.description": "",
    "modules.meta.modules.list.output.modules.properties.label.description": "",
    "modules.meta.modules.list.output.modules.properties.module_id.description": "",
    "modules.meta.modules.list.output.modules.properties.output_schema.description": "",
    "modules.meta.modules.list.output.modules.properties.params_schema.description": "",
    "modules.meta.modules.list.output.modules.properties.tags.description": "",
    "modules.meta.modules.list.params.category.description": "",
    "modules.meta.modules.list.params.category.label": "",
    "modules.meta.modules.list.params.format.description": "",
    "modules.meta.modules.list.params.format.label": "",
    "modules.meta.modules.list.params.include_output.description": "",
    "modules.meta.modules.list.params.include_output.label": "",
    "modules.meta.modules.list.params.include_params.description": "",
    "modules.meta.modules.list.params.include_params.label": "",
    "modules.meta.modules.list.params.tags.description": "",
    "modules.meta.modules.list.params.tags.label": "",
    "modules.meta.modules.list.params.type": "",
    "modules.meta.modules.test_generator.description": "",
    "modules.meta.modules.test_generator.label": "",
    "modules.meta.modules.update_docs.description": "",
    "modules.meta.modules.update_docs.label": "",
    "modules.meta.modules.update_docs.output.categories.description": "",
    "modules.meta.modules.update_docs.output.file_path.description": "",
    "modules.meta.modules.update_docs.output.modules_count.description": "",
    "modules.meta.modules.update_docs.params.include_examples.description": "",
    "modules.meta.modules.update_docs.params.include_examples.label": "",
    "modules.meta.modules.update_docs.params.output_path.description": "",
    "modules.meta.modules.update_docs.params.output_path.label": ""
  }
}