{
    "$schema": "../../../schema/locale.schema.json",
    "locale": "pl",
    "category": "cloud.traces",
    "version": "1.0.0",
    "translations": {
        "traces.detail.duration": "Czas trwania",
        "traces.detail.openNew": "Otworz w nowej karcie",
        "traces.detail.selectPrompt": "Wybierz slad, aby zobaczyc szczegoly",
        "traces.detail.spans": "Spany",
        "traces.detail.status": "Status",
        "traces.detail.title": "Szczegoly sladu",
        "traces.detail.traceId": "ID sladu",
        "traces.filter.allStatus": "Wszystkie statusy",
        "traces.filter.completed": "Zakonczone",
        "traces.filter.failed": "Nieudane",
        "traces.filter.running": "W trakcie",
        "traces.list.empty": "Nie znaleziono sladow",
        "traces.list.title": "Slady",
        "traces.search.placeholder": "Szukaj wedlug ID sladu, nazwy przeplywu...",
        "traces.spanDetail.duration": "Czas trwania",
        "traces.spanDetail.endTime": "Czas zakonczenia",
        "traces.spanDetail.error": "Blad",
        "traces.spanDetail.logs": "Logi",
        "traces.spanDetail.module": "Modul",
        "traces.spanDetail.operation": "Operacja",
        "traces.spanDetail.spanId": "ID spana",
        "traces.spanDetail.startTime": "Czas rozpoczecia",
        "traces.spanDetail.status": "Status",
        "traces.spanDetail.tags": "Tagi",
        "traces.spanDetail.title": "Szczegoly spana",
        "traces.waterfall.empty": "Brak spanow do wyswietlenia",
        "traces.waterfall.title": "Oś czasu spanow"
    }
}
