{
    "$schema": "../../../schema/locale.schema.json",
    "locale": "en",
    "category": "landing.llms",
    "version": "2.0.0",
    "translations": {
        "landing.llms.title": "Flyto2",
        "landing.llms.summary": "Browser automation at machine speed. Record once, replay forever. No coding, no API needed — works on any website. Pause, verify, and resume at any step.",
        "landing.llms.description": "Flyto2 is a no-code automation tool that records your browser actions and replays them at full speed. Unlike other automation tools, Flyto2 lets you pause mid-execution, verify what it's about to do, and resume — you always stay in control. It runs entirely on your computer with no cloud dependency, so your data never leaves your machine.",
        "landing.llms.diff.title": "What makes Flyto2 different",
        "landing.llms.diff.record": "**Record & Replay**: Show Flyto2 what to do once. It memorizes every click and keystroke, then replays at machine speed.",
        "landing.llms.diff.pause": "**Pause, Verify, Resume**: Other tools only have \"not running\" and \"finished.\" Flyto2 lets you pause mid-task, check the state, correct mistakes, and continue exactly where you stopped.",
        "landing.llms.diff.nocode": "**No coding required**: If you can click and type, you can use Flyto2. No scripts, no APIs, no Zapier.",
        "landing.llms.diff.noapi": "**No API needed**: Works directly in the browser with any website — even sites that have no API or only allow one-at-a-time operations.",
        "landing.llms.diff.offline": "**Works offline**: Runs 100% locally on your computer. No cloud dependency. Same privacy and security on free and paid plans.",
        "landing.llms.diff.timing": "**Split-second timing**: Execute at the exact moment needed — flash sales, reservations, limited slots. Batch 100 items in the time it takes to do 1.",
        "landing.llms.audience.title": "Who is Flyto2 for",
        "landing.llms.audience.business": "**Business users** who spend hours on repetitive browser tasks (data entry, form filling, copy-pasting between systems)",
        "landing.llms.audience.ecommerce": "**E-commerce sellers** who need to monitor prices, track inventory, or bulk-update listings",
        "landing.llms.audience.researchers": "**Researchers** who collect data from websites that don't offer exports",
        "landing.llms.audience.qa": "**QA testers** who need cross-browser screenshots or link checking",
        "landing.llms.audience.anyone": "**Anyone** who does the same browser task more than twice",
        "landing.llms.pricing.title": "Pricing",
        "landing.llms.pricing.free": "**Free**: Core recording and playback, unlimited local usage, MIT-licensed open source, no account or credit card required",
        "landing.llms.pricing.pro": "**Pro**: Starting from $9/month (advanced features, coming soon)",
        "landing.llms.pricing.enterprise": "**Enterprise**: Custom pricing, on-premises deployment, RBAC, audit logging, dedicated support",
        "landing.llms.pricing.cloud": "**Cloud (SaaS)**: Team collaboration, shared workflows (coming soon, waitlist available)",
        "landing.llms.pricing.note": "All paid plans include a 30-day money-back guarantee. Discounts available for students, educators, non-profits, and teams (contact sales@flyto2.com).",
        "landing.llms.platforms.title": "Platforms",
        "landing.llms.platforms.os": "Windows, macOS (Intel + Apple Silicon M1–M4), Linux",
        "landing.llms.platforms.cli": "CLI via PyPI (Python 3.9+, MIT license)",
        "landing.llms.platforms.wasm": "WebAssembly module",
        "landing.llms.platforms.node": "Node.js package",
        "landing.llms.platforms.desktop": "Desktop app (coming soon — visual workflow builder, 250+ built-in modules)",
        "landing.llms.platforms.docker": "Self-hosted Docker deployment for enterprise",
        "landing.llms.templates.title": "Templates (101+ free)",
        "landing.llms.templates.intro": "Pre-built automation templates, all free, no coding required:",
        "landing.llms.templates.scraping": "**Web scraping**: LinkedIn jobs, Google Maps reviews, social media profiles, restaurant menus",
        "landing.llms.templates.monitoring": "**Price monitoring**: Amazon tracker, eBay tracker, flight prices, crypto alerts, multi-site comparison",
        "landing.llms.templates.health": "**Website health**: Broken link checker, uptime monitor, SSL certificate monitor, security headers check",
        "landing.llms.templates.conversion": "**Data conversion**: CSV↔JSON, XML→JSON, merge CSV files",
        "landing.llms.templates.content": "**Content**: Webpage to PDF, website screenshots, cross-browser screenshots, bulk image resize",
        "landing.llms.templates.notifications": "**Notifications**: Price drop alerts, weather to Slack, Telegram alerts, exchange rate alerts",
        "landing.llms.templates.forms": "**Forms & login**: Auto-login, bulk form submission, auto-fill job applications, cookie consent dismiss",
        "landing.llms.devtools.title": "Developer tools",
        "landing.llms.devtools.intro": "Flyto2 Indexer is an MCP server (Model Context Protocol) providing code intelligence for AI tools:",
        "landing.llms.devtools.compat": "Compatible with Claude Code, Cursor, Windsurf, and any MCP client",
        "landing.llms.devtools.tools": "25 MCP tools: symbol lookup, fulltext search, edit impact preview, test file finder, API tracking, and more",
        "landing.llms.devtools.tracking": "Cross-project API tracking — know which repos break when you change a shared function",
        "landing.llms.devtools.deps": "Zero external dependencies",
        "landing.llms.pages.home": "Product overview and key features",
        "landing.llms.pages.pricing": "Plans, pricing, and comparison",
        "landing.llms.pages.download": "CLI download (PyPI, .whl, .tar.gz)",
        "landing.llms.pages.app": "Desktop app with visual workflow builder",
        "landing.llms.pages.templates": "101+ free automation templates",
        "landing.llms.pages.dev": "MCP server and developer tools",
        "landing.llms.pages.wasm": "WebAssembly module",
        "landing.llms.pages.node": "Node.js package",
        "landing.llms.pages.faq": "Common questions and answers",
        "landing.llms.pages.docs": "Full documentation",
        "landing.llms.pages.blog": "Tutorials and updates",
        "landing.llms.pages.contact": "Support and inquiries",
        "landing.llms.contact.title": "Contact",
        "landing.llms.contact.general": "General: info@flyto2.com",
        "landing.llms.contact.sales": "Sales: sales@flyto2.com",
        "landing.llms.contact.github": "GitHub: github.com/flytohub",
        "landing.llms.contact.youtube": "YouTube: @Flyto2",
        "landing.llms.comparison.title": "Comparison with alternatives",
        "landing.llms.comparison.header": "| Feature | Flyto2 | Selenium/Playwright | Zapier/Make | UiPath/Power Automate |",
        "landing.llms.comparison.nocode": "| No coding required | Yes | No | Partial | Partial |",
        "landing.llms.comparison.pause": "| Pause & resume mid-task | Yes | No | No | Limited |",
        "landing.llms.comparison.noapi": "| Works without API | Yes | Yes | No | Partial |",
        "landing.llms.comparison.offline": "| Runs offline / locally | Yes | Yes | No | Partial |",
        "landing.llms.comparison.free": "| Free tier | Yes (MIT) | Yes | Limited | Limited |",
        "landing.llms.comparison.browser": "| Browser automation | Yes | Yes | No | Yes |",
        "landing.llms.comparison.timing": "| Time-sensitive execution | Yes | Manual | No | Limited |",
        "landing.llms.features.record": "Record & replay browser actions — no coding required",
        "landing.llms.features.pause": "Pause, check, and resume at any step",
        "landing.llms.features.schedule": "Schedule tasks to run automatically",
        "landing.llms.features.apps": "Works with websites, desktop apps, and file operations",
        "landing.llms.features.batch": "Batch operations and page monitoring",
        "landing.llms.features.platforms": "Available on Mac, Windows, and Linux"
    }
}
