{
  "$schema": "../../schema/locale.schema.json",
  "locale": "id",
  "category": "landing.node",
  "version": "1.0.0",
  "translations": {
    "landing.node.code.subtitle": "Pratinjau API yang sederhana dan intuitif",
    "landing.node.code.title": "API Bersih",
    "landing.node.comparison.consistent": "Perilaku konsisten di mana saja",
    "landing.node.comparison.documentation": "Dokumentasi terpadu",
    "landing.node.comparison.forNode": "Untuk Pengembang Node.js",
    "landing.node.comparison.forTeams": "Untuk Tim",
    "landing.node.comparison.nativeJs": "JavaScript/TypeScript Asli",
    "landing.node.comparison.noSpawn": "Tanpa child_process atau spawn Python",
    "landing.node.comparison.sameApi": "API yang sama seperti versi Python",
    "landing.node.comparison.shareWorkflows": "Bagikan alur kerja lintas bahasa",
    "landing.node.comparison.singleRuntime": "Runtime tunggal, tidak perlu Python",
    "landing.node.comparison.subtitle": "Kekuatan yang sama, asli untuk ekosistem JavaScript Anda",
    "landing.node.comparison.title": "Mengapa Flyto2 untuk Node.js?",
    "landing.node.comparison.treeShaking": "ES modul yang bisa di-tree-shake",
    "landing.node.features.asyncAwait": "Async/Await",
    "landing.node.features.asyncAwaitDesc": "Dukungan async/await asli. Tanpa callback, tanpa janji neraka.",
    "landing.node.features.browser": "Otomatisasi Browser",
    "landing.node.features.browserDesc": "Integrasi Playwright untuk otomatisasi browser tanpa kepala.",
    "landing.node.features.lightweight": "Ringan",
    "landing.node.features.lightweightDesc": "Ketergantungan minimal. Instalasi cepat, ukuran bundel kecil.",
    "landing.node.features.modules": "250+ Modul",
    "landing.node.features.modulesDesc": "Modul kuat yang sama seperti Python. String, array, pemrosesan data, dan lainnya.",
    "landing.node.features.subtitle": "Otomatisasi Node.js asli dengan dukungan TypeScript kelas satu",
    "landing.node.features.tested": "Teruji",
    "landing.node.features.testedDesc": "Keandalan yang sama seperti versi Python. Suite pengujian komprehensif.",
    "landing.node.features.title": "Yang Akan Datang",
    "landing.node.features.typescript": "TypeScript Utama",
    "landing.node.features.typescriptDesc": "Dukungan penuh TypeScript dengan definisi tipe lengkap. IntelliSense di mana-mana.",
    "landing.node.hero.cliAvailable": "Butuh otomatisasi sekarang?",
    "landing.node.hero.comingSoon": "Segera Hadir",
    "landing.node.hero.emailPlaceholder": "Masukkan email Anda",
    "landing.node.hero.notifyDesc": "Jadilah yang pertama tahu saat paket npm diterbitkan.",
    "landing.node.hero.notifyMe": "Beri Tahu Saya",
    "landing.node.hero.notifySuccess": "Anda sudah terdaftar! Kami akan mengirim email saat siap.",
    "landing.node.hero.subtitle": "Otomatisasi alur kerja yang kuat untuk proyek JavaScript dan TypeScript.",
    "landing.node.hero.title": "Flyto2 untuk Node.js",
    "landing.node.hero.tryCli": "Coba Flyto2 Core (Python)"
  }
}
