{
    "$schema": "../../../schema/locale.schema.json",
    "locale": "zh-TW",
    "category": "cache",
    "version": "1.0.0",
    "translations": {
        "modules.cache.clear.description": "清除所有快取項目或按模式篩選",
        "modules.cache.clear.label": "快取清除",
        "modules.cache.clear.output.backend.description": "使用的後端",
        "modules.cache.clear.output.cleared_count.description": "清除的快取項目數量",
        "modules.cache.clear.params.backend.description": "使用的快取後端",
        "modules.cache.clear.params.backend.label": "後端",
        "modules.cache.clear.params.pattern.description": "匹配鍵的全域模式（例如 \"user:*\"，預設 \"*\" 清除所有）",
        "modules.cache.clear.params.pattern.label": "模式",
        "modules.cache.clear.params.redis_url.description": "Redis 連線 URL",
        "modules.cache.clear.params.redis_url.label": "Redis URL",
        "modules.cache.delete.description": "根據鍵刪除快取項目",
        "modules.cache.delete.label": "快取刪除",
        "modules.cache.delete.output.backend.description": "使用的後端",
        "modules.cache.delete.output.deleted.description": "鍵是否找到並刪除",
        "modules.cache.delete.output.key.description": "快取鍵",
        "modules.cache.delete.params.backend.description": "使用的快取後端",
        "modules.cache.delete.params.backend.label": "後端",
        "modules.cache.delete.params.key.description": "要刪除的快取鍵",
        "modules.cache.delete.params.key.label": "快取鍵",
        "modules.cache.delete.params.redis_url.description": "Redis 連線 URL",
        "modules.cache.delete.params.redis_url.label": "Redis URL",
        "modules.cache.get.description": "根據鍵從快取中獲取值",
        "modules.cache.get.label": "快取獲取",
        "modules.cache.get.output.backend.description": "使用的後端",
        "modules.cache.get.output.hit.description": "是否在快取中找到鍵",
        "modules.cache.get.output.key.description": "快取鍵",
        "modules.cache.get.output.value.description": "快取的值（若未找到則為 null）",
        "modules.cache.get.params.backend.description": "使用的快取後端",
        "modules.cache.get.params.backend.label": "後端",
        "modules.cache.get.params.key.description": "要查找的快取鍵",
        "modules.cache.get.params.key.label": "快取鍵",
        "modules.cache.get.params.redis_url.description": "Redis 連線 URL",
        "modules.cache.get.params.redis_url.label": "Redis URL",
        "modules.cache.set.description": "在快取中設定值，可選擇 TTL",
        "modules.cache.set.label": "快取設定",
        "modules.cache.set.output.backend.description": "使用的後端",
        "modules.cache.set.output.key.description": "快取鍵",
        "modules.cache.set.output.stored.description": "值是否成功儲存",
        "modules.cache.set.output.ttl.description": "TTL 秒數（0 = 不過期）",
        "modules.cache.set.params.backend.description": "使用的快取後端",
        "modules.cache.set.params.backend.label": "後端",
        "modules.cache.set.params.key.description": "要儲存值的快取鍵",
        "modules.cache.set.params.key.label": "快取鍵",
        "modules.cache.set.params.redis_url.description": "Redis 連線 URL",
        "modules.cache.set.params.redis_url.label": "Redis URL",
        "modules.cache.set.params.ttl.description": "存活時間（秒）（0 = 不過期）",
        "modules.cache.set.params.ttl.label": "TTL（秒）",
        "modules.cache.set.params.value.description": "要快取的值（任何可 JSON 序列化的值）",
        "modules.cache.set.params.value.label": "值"
    }
}
