{
    "$schema": "../../../schema/locale.schema.json",
    "locale": "fr",
    "category": "convert",
    "version": "1.0.0",
    "translations": {
        "modules.convert.to_array.description": "Convertir la valeur en tableau",
        "modules.convert.to_array.label": "En Tableau",
        "modules.convert.to_array.output.length.description": "Tableau converti",
        "modules.convert.to_array.output.original_type.description": "Tableau converti",
        "modules.convert.to_array.output.result.description": "Délimiteur pour la division de chaîne",
        "modules.convert.to_array.params.delimiter.description": "Diviser la chaîne en caractères",
        "modules.convert.to_array.params.delimiter.label": "Diviser la chaîne",
        "modules.convert.to_array.params.split_string.description": "Valeur à convertir",
        "modules.convert.to_array.params.split_string.label": "Valeur",
        "modules.convert.to_array.params.value.description": "Valeur à convertir",
        "modules.convert.to_array.params.value.label": "Valeur",
        "modules.convert.to_boolean.description": "Convertir la valeur en booléen",
        "modules.convert.to_boolean.label": "En Booléen",
        "modules.convert.to_boolean.output.original_type.description": "Booléen converti",
        "modules.convert.to_boolean.output.result.description": "Accepter uniquement les chaînes true/false",
        "modules.convert.to_boolean.params.strict.description": "Valeur à convertir",
        "modules.convert.to_boolean.params.strict.label": "Valeur",
        "modules.convert.to_boolean.params.value.description": "Valeur à convertir",
        "modules.convert.to_boolean.params.value.label": "Valeur",
        "modules.convert.to_number.description": "Convertir la valeur en nombre",
        "modules.convert.to_number.label": "En Nombre",
        "modules.convert.to_number.output.original_type.description": "Nombre converti",
        "modules.convert.to_number.output.result.description": "Convertir en entier",
        "modules.convert.to_number.output.success.description": "Nombre converti",
        "modules.convert.to_number.params.default.description": "Valeur à convertir",
        "modules.convert.to_number.params.default.label": "Valeur",
        "modules.convert.to_number.params.integer.description": "Valeur par défaut si la conversion échoue",
        "modules.convert.to_number.params.integer.label": "Par Défaut",
        "modules.convert.to_number.params.value.description": "Valeur à convertir",
        "modules.convert.to_number.params.value.label": "Valeur",
        "modules.convert.to_object.description": "Convertir la valeur en objet",
        "modules.convert.to_object.label": "En Objet",
        "modules.convert.to_object.output.keys.description": "Objet converti",
        "modules.convert.to_object.output.original_type.description": "Objet converti",
        "modules.convert.to_object.output.result.description": "Nom de clé pour envelopper les non-objets",
        "modules.convert.to_object.params.key_name.description": "Valeur à convertir",
        "modules.convert.to_object.params.key_name.label": "Valeur",
        "modules.convert.to_object.params.value.description": "Valeur à convertir",
        "modules.convert.to_object.params.value.label": "Valeur",
        "modules.convert.to_string.description": "Convertir toute valeur en chaîne",
        "modules.convert.to_string.label": "En Chaîne",
        "modules.convert.to_string.output.original_type.description": "Représentation en chaîne",
        "modules.convert.to_string.output.result.description": "Formater les objets/tableaux avec indentation",
        "modules.convert.to_string.params.pretty.description": "Valeur à convertir",
        "modules.convert.to_string.params.pretty.label": "Valeur",
        "modules.convert.to_string.params.value.description": "Valeur à convertir",
        "modules.convert.to_string.params.value.label": "Valeur"
    }
}
