{
  "$schema": "../../schema/locale.schema.json",
  "locale": "tr",
  "category": "scheduler",
  "version": "1.0.0",
  "translations": {
    "modules.scheduler.cron_parse.description": "Cron ifadesini ayrıştır ve sonraki N çalıştırma zamanlarını hesapla",
    "modules.scheduler.cron_parse.label": "Cron İfadesini Ayrıştır",
    "modules.scheduler.cron_parse.output.description.description": "Programın insan tarafından okunabilir açıklaması",
    "modules.scheduler.cron_parse.output.expression.description": "Ayrıştırılmış cron ifadesi",
    "modules.scheduler.cron_parse.output.is_valid.description": "İfadenin geçerli olup olmadığı",
    "modules.scheduler.cron_parse.output.next_runs.description": "Sonraki çalıştırma zamanlarının ISO tarih saat dizeleri listesi",
    "modules.scheduler.cron_parse.params.count.description": "Hesaplanacak sonraki çalıştırma sayısı",
    "modules.scheduler.cron_parse.params.count.label": "Çalıştırma Sayısı",
    "modules.scheduler.cron_parse.params.expression.description": "Standart 5 alanlı cron ifadesi (ör. \"0 9 * * MON-FRI\")",
    "modules.scheduler.cron_parse.params.expression.label": "Cron İfadesi",
    "modules.scheduler.cron_parse.params.timezone.description": "Hesaplama için zaman dilimi (UTC ofseti \"+8\" veya \"-5\" gibi, varsayılan \"0\" UTC için)",
    "modules.scheduler.cron_parse.params.timezone.label": "Zaman Dilimi",
    "modules.scheduler.delay.description": "Belirtilen süre boyunca yürütmeyi duraklat",
    "modules.scheduler.delay.label": "Gecikme / Uyku",
    "modules.scheduler.delay.output.delayed_seconds.description": "Gerçek gecikme süresi saniye cinsinden",
    "modules.scheduler.delay.output.message.description": "Sağlanan mesaj veya varsayılan",
    "modules.scheduler.delay.params.message.description": "Sonuçta dahil edilecek isteğe bağlı mesaj",
    "modules.scheduler.delay.params.message.label": "Mesaj",
    "modules.scheduler.delay.params.seconds.description": "Gecikme süresi saniye cinsinden",
    "modules.scheduler.delay.params.seconds.label": "Gecikme Saniyesi",
    "modules.scheduler.interval.description": "Aralık zamanlamasını ve sonraki gerçekleşmeleri hesapla",
    "modules.scheduler.interval.label": "Aralığı Hesapla",
    "modules.scheduler.interval.output.human_readable.description": "İnsan tarafından okunabilir aralık açıklaması",
    "modules.scheduler.interval.output.interval_seconds.description": "Toplam aralık süresi saniye cinsinden",
    "modules.scheduler.interval.output.next_runs.description": "Sonraki 5 çalıştırma zamanının ISO tarih saat dizeleri listesi",
    "modules.scheduler.interval.params.hours.description": "Aralık saat bileşeni",
    "modules.scheduler.interval.params.hours.label": "Saat",
    "modules.scheduler.interval.params.minutes.description": "Aralık dakika bileşeni",
    "modules.scheduler.interval.params.minutes.label": "Dakika",
    "modules.scheduler.interval.params.seconds.description": "Aralık saniye bileşeni",
    "modules.scheduler.interval.params.seconds.label": "Saniye",
    "modules.scheduler.interval.params.start_time.description": "ISO 8601 formatında başlangıç saati (varsayılan: şimdi)",
    "modules.scheduler.interval.params.start_time.label": "Başlangıç Saati"
  }
}
