{
  "$schema": "../../schema/locale.schema.json",
  "locale": "ja",
  "category": "training",
  "version": "1.0.0",
  "translations": {
    "modules.training.practice.analyze.description": "練習用のウェブサイト構造を分析",
    "modules.training.practice.analyze.label": "練習分析",
    "modules.training.practice.analyze.output.status.description": "ウェブサイト構造を分析",
    "modules.training.practice.analyze.output.structure.description": "ウェブサイト構造を分析",
    "modules.training.practice.execute.description": "練習セッションを実行",
    "modules.training.practice.execute.label": "練習実行",
    "modules.training.practice.execute.output.items_processed.description": "練習セッションを実行",
    "modules.training.practice.execute.output.status.description": "練習セッションを実行",
    "modules.training.practice.infer_schema.description": "ウェブサイトからデータスキーマを推論",
    "modules.training.practice.infer_schema.label": "練習スキーマ推論",
    "modules.training.practice.infer_schema.output.schema.description": "データスキーマを推論",
    "modules.training.practice.infer_schema.output.status.description": "データスキーマを推論",
    "modules.training.practice.stats.description": "練習統計を取得",
    "modules.training.practice.stats.label": "練習統計",
    "modules.training.practice.stats.output.history.description": "練習統計を取得",
    "modules.training.practice.stats.output.success_rate.description": "練習統計を取得",
    "modules.training.practice.stats.output.successful_sessions.description": "総セッション数",
    "modules.training.practice.stats.output.total_sessions.description": "総セッション数"
  }
}
