{
  "$schema": "../../schema/locale.schema.json",
  "locale": "it",
  "category": "cloud.triggerInbox",
  "version": "1.0.0",
  "translations": {
    "triggerInbox.allStatuses": "All statuses",
    "triggerInbox.autoRefreshOff": "Auto-refresh off",
    "triggerInbox.autoRefreshOn": "Auto-refresh on",
    "triggerInbox.claim": "Richiedi",
    "triggerInbox.claimedAt": "Claimed at",
    "triggerInbox.completed": "Completato",
    "triggerInbox.createdAt": "Created at",
    "triggerInbox.device": "Dispositivo",
    "triggerInbox.error": "Errore",
    "triggerInbox.eventClaimed": "Event claimed",
    "triggerInbox.eventCompleted": "Event completed",
    "triggerInbox.eventDetails": "Event details",
    "triggerInbox.eventFailed": "Event failed",
    "triggerInbox.failed": "Fallito",
    "triggerInbox.markComplete": "Mark complete",
    "triggerInbox.markFailed": "Mark failed",
    "triggerInbox.noEvents": "No events",
    "triggerInbox.noEventsDesc": "No events available",
    "triggerInbox.payload": "Carico",
    "triggerInbox.pending": "In attesa",
    "triggerInbox.processing": "In elaborazione",
    "triggerInbox.result": "Risultato",
    "triggerInbox.showing": "Showing",
    "triggerInbox.status": "Stato",
    "triggerInbox.subtitle": "Subtitle",
    "triggerInbox.table.actions": "Azioni",
    "triggerInbox.table.status": "Stato",
    "triggerInbox.table.time": "Tempo",
    "triggerInbox.table.trigger": "Attiva",
    "triggerInbox.table.workflow": "Flusso di lavoro",
    "triggerInbox.title": "Trigger inbox"
  }
}
